5743,I don't know where I'd be if I had continued taking lipitor beyond the 3 days!!!.
5744,Not much -- occasional itchiness.
5745,"I was taking Red Yeast statins for chlolesterol of 230, but then big-pharma got in the picture and made that illegal."
5746,Don't know if that is still the case.
5747,My doctor said Lipitor was the most tested statin drug.
5748,My real concern is heart disease which is in my family.
5749,Not sure of how tight the correlation is between low chlosterol numbers and low risk of coronary problems.
5750,AMA dumbs down the information to make is sound like getting down to ridiculous levels (100) insures that you won't have problems.
5751,I doubt it.
5752,Probably much more based on genetic history.
5753,"So Lipitor is great for reducing your numbers, but extending your life ???."
5754,SEVERE FATIGUE IN MY BODY AND TIREDNESS AND MUSCLE PAINS IN MY HIPS THAT CONTINUE TO THIS DAY AFTER BEING OFF THE DRUG FOR ALMOST A YEAR.
5755,DO NOT TAKE THIS DRUG!!!!!!!.
5756,I was put on this drug by my doctor for my somewhat high cholesterol.
5757,"The next day, after starting this drug, I suddenly felt like I had aged to eighty years old overnight but did not connect it to starting Lipitor."
5758,"Up until the start of this drug I felt that I was as young as I was in my twenties and wondered if this is how you might start feeling the affects of age, by waking up one morning and feeling all that age caught up with you and now you were older than your years."
5759,I took the drug for two terrible months and then had a blood test and my cholesterol had dropped.
5760,My doctor mailed me the results of my blood test but did not send me a new prescription like he had the last time so I did not know that he wanted me to get it refilled.
5761,So I went off of Lipitor and within two months I was feeling normal again and even took a job with the post office where I walked five miles a day with no problem.
5762,"I did not associate my getting better with my coming off Lipitor, unfortunately."
5763,Then I had an appointment with my doctor and he said I should have refilled that prescription by calling his office.
5764,"So I did and the next day, after taking only one pill, I was eighty years old again."
5765,This time I did associate it with the start of Lipitor and then read the warnings the drug store gives you with meds and found that my symptoms were the same as what they warned against.
5766,I am not a hypochondriac and I never read those warnings so this was not a head thing.
5767,I immediately went off the drug but a year later I am still have the same eighty years old feeling and do not know that I will ever be normal again.
5768,I do not understand how just one pill can do that and this time I am not recovering like I did the first time.
5769,This has ruined my life and I would never have taken Lipitor if I knew what I know now and I am so sorry that I ever heard of this drug.
5770,This is so severe that I think taking it for even a short time can cause permanent damage.
5771,"My doctor, when I told him of all this, wanted to change statins because he was still worried about my cholesterol."
5772,"I told him no more statins and he then prescribed Zetia, which he said was was less effective but was not a statin, which I am still afraid to take unless I improve from the affects of the Lipitor."
5773,"He told me he was on Lipitor himself and that he had no problems but then said, well he did have neck pains that could have been a side affect, but that he had been on the drug two years before this developed."
5774,I told him of the information on this site that describes some people having that delayed reaction and I advised him to take himself off of this drug for a couple of weeks to see if the neck pains cleared up!
5775,"I advise, DO NOT TAKE THIS DRUG!!!!!."
5776,muscle aches in arms.
5777,"Taking Lipitor 20 mg for 4 months now together with plavix, Zestril and Lopressor."
5778,Zestril and Lopressor caused many prblems so am on diovan instaed.
5779,Lipitor has recently started causing pain in back and behind the knee.
5780,Also developed hematuria .
5781,all urine test came back normal.
5782,Did anybody else experienced hematuria as a result of Lipitor use?.
5783,Am quitiing this medicine.
5784,very dangerous and should be used in extreme circumstances.
5786,"day two of taking the product, and I have pain and tingling in my fingers as well as a major sharp pain in the side, which could be of of many things including simply gas - a common problem as reported here."
5787,"Way too early to post something more constructive, but I will come back later."
5788,Thanks to all posters here - big relief from your reports to know this is not unusual.
5789,"I female, 5 feet 7 and a half inches tall, 117 lbs."
5790,I do not smoke and have never smoked.
5791,"I do not have high blood pressure, nor have I ever had it."
5792,I am not diabetic.
5793,I am 45 and a half years old and was on 20 mg of Lipitor due to genetically high LDL for a period of seven months.
5794,"At that point, I started having terrible, migratory joint pain all over my body that was very distinct and pronounced."
5795,I also had disabling fatigue and flu-like malaise.
5796,Some nights I would go to bed at 6 pm and not get up until 8 or 9 the next morning.
5797,I was quite ill.
5798,"My doctor did tons of lab work to rule out things like rheumatoid arthriitis, lupus, Lyme disease and active parvovirus infection."
5799,These all came back NEGATIVE.
5800,"Finally, I was taken off Lipitor to see if the drug had anything to do with my symptoms."
5801,"Within 72 hours I noted an improvement; within seven days, the symptoms were completely gone and I was restored to health."
5802,I will not ever take Lipitor again as I believe it is liver-toxic and slowly poisons the patient.
5803,It did a great job of lowering my LDL (173 down to 60).
5804,My total cholesterol went from 238 down to 143.
5805,"However, it nearly killed me in the process and I believe it is almost like a slow-acting poison."
5806,Didn't associate my problems with Lipitor until reading this web site.
5807,I've been on Lipitor for about 7 mos.
5808,"Have had problems with my hips and knees in the past but just within the last year I've been experiencing spasms in upper thighs, especially after doing anything physical."
5809,Now I have a dr. apptmt. in a few days because my right knee is so painful I can't even bend it!
5810,"It hurts to get up in the morning, get out of a chair, go up stairs."
5811,"Also, I have had operations on my right foot a few years ago, but now it hurts almost as much if not more."
5812,The bottom of my foot is extremely tender as are my calves.
5813,The Lipitor did lower my cholesteral wonderfully; but I'm extremely concerned that this may be what my problems are coming from.
5814,"Hopefully, the dr. will tell me more this week."
5815,"Thank God, I found this site."
5816,"Pfizer Inc.(maker of Lipitor) AMOUNT AT ISSUE: $$$ Pending, Cholesterol-Fighting Drug Tied to Liver, Kidney Injury, The Kahn Gauthier Law Group is investigating possible legal actions against Pfizer Inc., the manufacturer of the cholesterol-lowering drug Lipitor (atorvastatin), to recover for liver or kidney damage suffered by patients prescribed Lipitor."
5817,"Like other drugs in its class (the statins), Lipitor can cause elevated liver enzymes."
5818,"In clinical trials, this occurred in 0.7 percent of the patients, but the rate was much higher for those taking the 80 mg dose."
5819,"Another serious side effect of Lipitor and other statins is a condition called rhabdomyolysis, in which muscle cells break down and release potentially toxic cell contents into the bloodstream.,"
5820,"Symptoms of rhabdomyolysis include muscle pain, tenderness and weakness--most commonly in the calves and lower back."
5821,"Malaise, fever, dark urine, vomiting and nausea can also be symptoms."
5822,"The most feared consequence of rhabdomyolysis is acute kidney failure, occurring in 30-40% of the cases."
5823,"Some of the warning signs of liver failure are nausea, vomiting, abdominal pain, fatigue, loss of appetite, dark urine, and generalized skin discoloration."
5824,"For more information on this case, you should become a member of ClassActionAmerica."
5826,My EKG was not good and a blood test also indicated a problem.
5827,"I was sent for a stress test which I failed, and was sent to a heart doctor."
5828,"I had no other symptoms of heart problems, but I had high blood pressure and overweight."
5829,So lipitor was prescribed to lessen likelihood of partial blockage to my heart.
5830,Cholesterol levels are terrific now and I may be sent for another stress test next month.
5831,I feel great on Lipitor but could not take Zocor(side effects).
5832,"Memory lapses, hip pains, skin itching sensations all over body,hair loss, depression and anxiety."
5833,Docs are into big paybacks from big drug companies.
5834,Patients come 2nd!!
5835,They think you're nuts when you complain about side effects.
5836,Stopping 20mg Lipitor today after 2 years.
5837,Will take the risk.
5838,"Severe B/L shoulder pain, general weakness, malaise, and slight memory loss."
5839,"I started out at 10 mg every day for 7 years, 20 mg for 1 year, 40 then 80 for over 1 1/2 years."
5840,"Over the past year, B/L shoulder pain to the point of wearing a sling because it hurt badly when I walked."
5841,I read about the shoulder pain in assorted sites on the web.
5842,Discussed it with my PA and cardiologist.
5843,My PA stopped the Lipitor.
5844,The pain lessened but did not stop.
5845,Went to a Ortho MD who gave me 3 Steroid shots and PT.
5846,It seemed to help but pain would not stop.
5847,Narcs were ordered which helped somewhat but wasn't the answer.
5848,MRI showed a slight linear tear in my Rotator Cuff which he wanted to do surgery.
5849,Decided against surgery.
5850,Both shoulders started to feel better but still couldn't sleep on my left side.
5851,My LDL's were through the roof.
5852,"After almost 10 months off Lipitor, my general MD talked me into starting Sinivastatin 40 mg every day."
5853,"Well, guess what happened."
5854,"My shoulder pain suddenly worsen, especially left side."
5855,I am going to speak with my Cardiologist again and explore alternatives and will be stopping my Statin today!
5856,Moral of the story.
5857,Stay clear of Statin medications.
5858,"Severe elbow, arm and shoulder pain."
5859,"It's just a little white pill, this can't be causing all of my pain."
5860,"Boy was I wrong, this pill has caused me so much grief."
5861,I couldn't even watch TV with my family as the pain in my arms and shoulder drove me to my bed.
5862,I felt so old and scared that the rest of my life would be pain filled.
5863,One week ago I ran out of lipitor and after a few days found that my arm & elbow pain subsided.
5864,Why isn't this widely known?
5865,"I'm angry and also sad, sad that I've wasted all this time and angry that the drug companies are getting richer by the second."
5866,NOT YET.
5867,"Headaches,body aches,joint stiffness,bloating,excessive gas,cramping,irritability."
5868,I took it for about 3 weeks before I started feeling any side effects.
5869,I didn't realize this was the cause until I researched a little to see what side effects had been encountered.
5870,It was pretty shocking when I found out I was suffering from half of those listed.
5871,And I just thought I had a.
5872,"General fatigue, aches and pains for years."
5873,Thought it was menopause.
5874,But recently--severe swolen/inflamation of the fingers/hands and wrist pain.
5875,"Have suffered with geneal aches and pains for years thinking very similar to alot of you, that it was just my age and I had to accept it!"
5876,"I have been suffering with severe swolen/inflamation of the fingers/hand & wrist pain for 8 months and attributed it to new blood pressure medicine or arthritis; however, after going off the new blood pressure meds for 5 weeks, I have noticed no remarkable change and have had blood work and x-rays indicating NO arthritis."
5877,"But now after finding this site, I'm wondering if it has been the Lipitor all along all of a sudden after taking it for 7.5 years."
5878,I am discontinuing the Lipitor immediately to see if I can find any change and relief.
5879,I agree with so many of you in saying that no cholesterol lowering drug is worth this kind of result!
5880,Thank you everyone for taking the time to write so we aren't prisoners to just our doctor's advice!.
5881,Aching weakness in legs back and shoulders.
5882,Side effects subsided after lipitor stopped.
5883,The drug is toxic and will probably kill you before the high cholesterol will.
5884,"Body aches (knees, back and especially chest) which increased with time, lethargic, short term memory lacking, concentration is worse than ever."
5885,Worked wonders for my cholesterol but ruined everything else.
5886,I kept telling my doctor about the body aches but he always blamed it on something else.
5887,"stress, anxiety, lack of exercise."
5888,I'm still on the lipitor but I'm contacting my doctor to try another cholesterol med.
5889,I'm glad I came across this site.
5890,"Hair loss (Diffuse Alopecia), hair thinning."
5891,I have had type 1 diabetes for 21 years.
5892,My blood sugar control has always been good (Hemoglobin A1C tests always below 6%).
5893,I have a healthy diet and a normal weight.
5894,My Thyroid function is normal.
5895,"I have been taking, Olmetec(olmesartan), Istin(amlodipine) and Lipitor(atorvastatin)."
5896,Since taking Lipitor my hair has started falling out at an alarming rate.
5897,The thinning is most pronounced at the back and sides of my head so it's not conventional male pattern baldness.
5898,Lipitor has certainly lowered by cholesterol but I've stopped taking it after 9 months.
5899,The stress caused by losing my hair in this way will probably do me more harm than having high cholesterol.
5900,very bad pain in my muscles.
5901,I am 51 years and have had acne breakouts on my face and neck.
5902,"SEVERE leg and foot pains, depression, balance and memeory problems."
5903,Feel as if I was 90 years old.
5904,Pain first thing in the morning trying to walk improves as day wears on.
5905,"Several x-rays, MRI's, cat scans."
5906,R/O MS.
5907,I quit taking four days ago and already feel better.
5908,Next dr's appt next week and I will inform Dr I WILL NOT take this RX again!.
5909,A good side effect - I take the lipitor at night because my husband had heard it works better taken at night.
5910,right away I was falling asleep more easily and sleeping through the night.
5911,I thought it was just me till I saw the notes here about tiredeness.
5912,I'm not tired during the day.
5913,"Back, hip thigh, knee pain, which is affecting my gait."
5914,Memory loss.
5915,I almost forgot(did I say memory loss?).
5916,fatigue.
5917,As the dose increases the pain has worsened.
5918,I have been on Lipitor for probably 10 yrs.
5919,Have tried nearly all statins with similar side effects.
5920,"10 mg no real side effects, no real benefits either; 40 mgs- fatigue, muscle aches but able to tolerate it though not happy and still no appreciable change in cholesterol."
5921,now on 80 mg and feeling extremely uncomfortable.
5922,Why am I on 80 mg?
5923,"because the insurance company required a trial at this high level, before I can switch to an alternative and reduce the dose back to 40 mg."
5924,Since when did the insurance company go to med school so they can dictate what I should be on.
5925,sorry for the rant.
5926,"Muscle Fatigue, Memory Loss, Cramping, Cold Extremities, Shortness of Breath, General Fatigue, Joint and Muscle Pain, Inability to Sleep and induced Depression."
5927,This Med was Prescribed to help control Scaling - not really necessary as all my blood work was within range.
5928,"I could not recommend this Medication to anyone, just too many side affects."
5929,"Fuzzy, dizzy, light-headedness feeling I've never had before."
5930,Low grade headache goes with it.
5931,Mild insomnia.
5932,"Poor concentration, noise intolerance."
5933,I rarely get headaches.
5934,"Started getting them a while back, never put 2 and 2 together."
5935,"Saw an internist and 2 neurolgists, had MRI, MRA, all showing nothing."
5936,"Stopped Lipitor 2 weeks ago, with 40% reduction in severity but still waiting for it to go away."
5937,Not many here have posted follow-up.
5938,"Because so many people take Lipitor, and headaches, etc are so coommon, what we need is to show that there is an increased incidence of side effects like these compared to those not taking Lipitor, AND that the side effects go away once stopping it."
5939,"I will re-post when either 3 months goes by or the side effects disappear, whichever is 1st."
5940,"I suspect that it will take at least a few more weeks, before the build-up effects of this mess can be cleared from my brain."
5941,Severe back pain.
5942,"Leg,finger and feet joint pain similar to arthritis."
5943,Planta fasciitis similarities.
5944,Big weight gain in stomach area.
5945,I am 55 and never felt so old in my life!.
5946,went down to 10 mlg after complaining about back pain.
5947,Doctor refuses to believe it is the medication causing the pain.
5948,None whatsoever.
5949,Cholesterol dropped from 180 (January 2005) to 123 (April 2005).
5950,LDL dropped to within normal range.
5951,"I've experienced tennis elbow and plantar fasciatis before, so I can't necessarily blame Lipitor."
5952,"I have also noticed slight neck pain, but that could have other causes like my varied exercise routine."
5953,It has sharply reduced my cholesterol level.
5954,"back ache, dizziness, leg cramps on exercise walk."
5955,Been on it 10 days; started Diovan 4 days ago.
5956,Side effects really kicked in over the last day or so.
5957,Don't which is the culprit since similar side effects are attributed to Diovan.
5958,any insights?.
5959,"pain in both legs, unable to climb stairs for eight months,unable to stand for any time with out extrem pain in knee joints."
5960,"When I notified the prescribing doctor ther was a problem, he eventualy said that there is a problem with the medication and the pain in the legs should subside in eight or nine weeks."
5961,It finaly took fifteen weeks and left me with two failed knee joits that were perfect before taking the medication.
5962,The product should be removed from the market for further evaluation.
5963,"After approx 5 years of Lipitor, I have been experiencing severe pains in my arms."
5964,Cardiologist suggested coming off Lipitor to see if this was the problem.
5965,"Off 2 weeks now and definitely better, almost gone."
5966,Now wondering about statin induced myopathy.
5967,Also take Cozaar for high BP and Bisoprolol for heart rythm.
5968,Tiredness exists.
5969,always put that down to the stresses of life.
5970,"Within a week or two of taking the prescribe dose, I began developing something I never had before: eczema."
5971,"It became progressively worse, and by the end of the first month had created a massive triangular rash on my forehead, as well as a patch on one cheek."
5972,"The skin was very red and rough, and made public life miserable and embarassing."
5973,"I stopped taking Lipitor and the rash cleared up greatly, but has NEVER gone away completly, flaring up slightly from time to time, but not nearly as bad as it was during dosing with Lipitor."
5974,"I was not taking any other medications at the time, and never had eczema before."
5975,"The anti-lipid effect of Lipitor was unusually strong in my case, causing my CHO to drop below 90 (from a baseline of over 200)."
5976,"by the end of the first 2 weeks of dosing, my physician had me cutting the smallest dose tablet in half to be taken once a day."
5977,"Even so, the rash continued to enlarge and get worse, so I was forced to stop taking the Lipitor."
5978,rashes - until I took it at night.
5979,"then after the first year - joint pains - until I switched to 3 times a week, still at night."
5980,"Could not get to sleep, then slept for 3 to 4 hours and was not rested."
5981,Diarrhea was constant and I didn't feel right.
5982,My body tells me when something is not good for me and I stopped taking it after 5 days.
5983,"Strange how the highest numbers for liking the drug, Lipitor, are listed first."
5984,Who backs this website?.
5985,"constant pain in right thigh, abdominal pain, intermittent pain throughout body, unable to walk more than 1/8 mile w/o excruciating pain in the leg, tingling of feet, elevated liver function."
5986,wicked drug.
5987,wonder how much my doc was compensated by the drug company for prescribing it.
5988,"Within 1 month time developed severe depression, inability to pull myself from bed, headaches everyday, and felt like I was coming down with flu."
5989,I will never take statins again.
5990,My doctor referenced Lipitor as a.
5991,My husband was on 10 mg for several years.
5992,"increasing muscle pain in legs, right hip, depression."
5993,Went to 20 mgs and had heart palpitations and more severe pain.
5994,"Thank, God, we went on a 10-day vacation."
5995,He forgot his Lipitor and pain decreased dramatically.
5996,We were able to make the connection.
5997,I want to shoot his doctor.
5998,When we returned from vaction he tried to start his dose and experienced flu-like symtoms and all-over muscle pain.
5999,Get off of it if you can.
6000,"Abdominal pain, headaches, diarrea, nausea, heartburn, weakness, muscle pain, flu symptoms, bad taste in mouth to the point I could not eat, Where do I stop, there were so many."
6001,For me I believe that this drug is a poison.
6002,My doctor gave me a low 10mg. dose so it took several months of slowly getting sick to be almost incapacitated.
6003,"Do yourself a favor, its called diet."
6004,Cholesterol way down.
6005,No problems that I can associate with the drug.
6006,"My wife and I bo,th shared weakness in legs, pain in legs, hair losss, Rashes, itchy when I went to sit down instead of sitng normaly I would almost fall down in the chair no control no strength, upon getting up I had to hold on to something to get up."
6007,"No stopping action going down hill, arms, hands, have little or no grip, I am on 20 mgs, my wife 10,,, we have stopped as of this date."
6008,"I(male) have been on Lipitor for almost 3 yrs, I had open heart surgery 3 yrs ago and since then Ive been on it, My wife gets burning sensations, pains in her back, frequent urination(both of us) and a hard time sleeping."
6009,Its bad news.
6010,"Weight gain, extreme muscle aches and fatigue, alternating constipation and diarrhea, more frequent asthma flare-ups, insomnia, weird dreams."
6011,"I had to walk with a cane because I was so weak and ached all over, especially in legs."
6012,My husband and I took ourselves off this medication 10 days ago.
6013,I can't tell you how much better we both feel off Lipitor.
6014,"I sleep better, don't need to use my cane, and can bend and move better after just 10 days off the medicine."
6015,DON'T TAKE LIPITOR--try garlique or a natural remedy.
6016,Lipitor hurts more than it helps.
6017,"EXTREME PAIN IN NECK AND SHOULDERS FOR THREE WEEKS, MEMORY LOSS, INABILITY TO FUNCTION, ZONED OUT, SICK TO MY STOMACH."
6018,VERY SCAREY DRUG.
6019,"Extreme fatigue, headaches, cramping in both calves, memory problems, like Im in a fog all the time."
6020,Dr has taken me off the drug.
6021,"Previously I have taken ZOCOR and MEVACOR with similar results, but not has pronounced as with LIPITOR."
6022,Find another way to reduce blood cholesterol.
6023,"Type II diabetic, formerly on oral medication but converted to insulin injections twice daily after bypass surgery."
6024,Prescribed Lipitor 40 mg/day although TC was below 200 mcg/dl.
6025,"After taking drug for several months, I experienced progressive unsteasiness walking & could not stand in one place for more than a few seconds without loss of balance."
6026,"Intermittent acute pain in both feet, for which I was prescribed Neurontin."
6027,Also experienced weakness in legs and knees causing some limping as well as numbness in fingers & general weakness in hands (difficulty removing gas cap on car).
6028,"After accidentally running out of Lipitor, I noticed a significant improvement in balance within 2-3 days."
6029,Also found that blood glucose level dropped significantly both AM and PM after halting Lipitor.
6030,I also discontinued Neurontin and began taking coenzyme Q10 120 mg/day.
6031,I have researched Lipitor and other statin drug side effects on internet and will no longer take Lipitor or any statin drugs.
6032,Feel much better after 30 days statin-free.
6033,Gradually declining physical ability.
6034,"Joint pain (elbows!), buzzing left leg (I thought my cell phone was in my pocket on vibrate!)."
6035,"Occasional loss of balance, MEMORY LOSS!, blurred vision."
6036,Dropped total Cholesterol from 245 to 185.
6037,GREAT SITE!
6038,I'm appalled at the state of the cholesterol war.
6039,My HDL has always been in the 60's which put me at a ratio of 4.0 or better.
6040,Dr.'s used to say that was all that mattered.
6041,"NOW, my new Dr prescribes Lipitor as my numbers are 'alarming'."
6042,"As an ex-olympic athlete, I still compete at a Masters level at age 43 and enjoy being a good athlete."
6043,"I have a high tolerance for pain, so the pain wasn't an issue, but I feel like I've aged 20 years!"
6044,I've slowed down considerably and don't have the tolerance I once did.
6045,My short-term memory disappeared.
