3794,"Very slowly over four months I began having leg cramps, noticed I was having difficulty picking my feet up, itching (tingling) around toes of right foot."
3795,Doctor suspected Neuropathy when Athlete's foot couldn't be detected.
3796,Neurologist said stop taking Lipitor immediately.
3797,The damage was done as it spread to my hands and up my legs.
3798,Have been off Lipitor eight months and still have problems.
3799,From what I read I fear this will be with me.
3800,This is dangerous as doctors are handing this out like candy and are not monitoring their patients closely.
3801,The dark side of Statins far overshadow the benefits.
3802,"severe depression, anxiety, sore joints, sore back, lack of energy."
3803,I recently went off it after I lost some wheight and felt great.
3804,did a 220 ldl reading and Dr put me back on it.
3805,Depression came with a vengence.
3806,"I have never gone for therapy, but had no choice."
3807,"they suggested a connection with the Lipitor, so I went searching - wow what an eye opening - I am not the only one."
3808,"As of now, never again will I take lipitor."
3809,I have been taking 10mg of Lipitor for 3 months.
3810,"After 1 month I had severe diarrhoea which cleared after 1 week , so I paid no attention to it."
3811,Excessive gas another sympton which persists.
3812,For the past 2 weeks I have had back ache (which I have experienced before) but this time not cured by chiropractic treatment.
3813,I was puzzled!!
3814,Recently after walking for a while I experienced severe pain in my right leg from thigh to knee and then to ankle which caused me to limp.
3815,I found this website and I seem to have similar symtoms as others who take this medication.
3816,I see my GP tomorrow for the results of my first 3 month blood test.
3817,I shall come off the medication today.
3818,Thank you.
3819,I am a 61 year old male with a history of heart disease.
3820,I had a quadruple by-pass in 1987.
3821,I have not had any heart related issues since.
3822,My nurse practioner put me on Lipitor about 4 years ago.
3823,I have been experiencing pain in my right hip and right calf muscle for about 3 years.
3824,I have mentioned this on numerous office visits and was.
3825,"Extreme back pain, nerve damage, breathing problems to the point of hospitalization stiffness all over body, muscle damage, hugh black and blue marks 6 in., hair loss, dizzyness, vision problems, close to blackouts, sinus problems,temperature, heart palputations, abdominal problems, bleeding, gas."
3826,"Wore braces on calf, ankle, full knee brace and two small braces and crutches, wrist locked up on me, wore a brace for months, just to mention a few of the problems I had on all Statins."
3827,Doctors left me on Statins for seven years.
3828,My advise is not to go on any Statins I still hurt after 2 years off them.
3829,"gas, constipation."
3830,"I am writing this for my husband--memory loss, tremors in right hand, symptoms of parkinson's disease."
3831,"since lipitor causes a decrease in coenzyme q10 and now there is a study in the archives of neurology showing that using large doses of coenzyme q10 slows the progression of parkinson's disease, i wonder how many others have experienced a diagnosis of parkinson's having been on lipitor?"
3832,we began questioning the role of lipitor in Parkinson's when my niece's husband who is 57 was experiencing the same symptoms as my husband(the 57 yr old was diagnosed with Parkinson's 2 weeks ago) and the major factor in common between the 2 of them--Lipitor for 4+ yrs.
3833,not worth the risks of taking the drug.
3834,will now control cholesterol with diet and exercise.
3835,DEPRESSION!!
3836,"muscle twitching and pain, tired, loss of drive, irritable with my loved ones, insomnia, anxiety, loss of desire to do or accomplish anything which is the total opposite of my character and personality, huge drawback in quality of life."
3837,READ ----->.
3838,Be careful with this stuff.
3839,Had a total cholesterol of about 230.
3840,saw results after first 3 months.
3841,Had no other health concerns.
3842,Exercised on a regular basis and am in very good shape.
3843,This stuff grabbed me and ruined the this last year of my life.
3844,"I have no other risk factors for heart desease except a moderatly elevated cholesterol level, no family history or anything."
3845,Thought I would take lipitor just to be safe.
3846,Big mistake.
3847,Went to my doctor and told him I wasn't going to take the lipitor any more.
3848,Told him I was presenting with some very adverse signs and symptoms and the only thing that had ever changed was the fact i was on Lipitor.
3849,"He was not happy with my decision and offered a switch to a different statin, I declined."
3850,He got aggitated and asked what articles I had been reading and where I got my information.
3851,"I told him I didn't need a medical journal to convince me this stuff was messing me up, I was living proof."
3852,4-5 days after stopping the Lipitor it was like someonebrought the sun out.
3853,Depression faded along with all the other psychological enigmas I was dealing with.
3854,"The only residuals I am now dealing with are some minor muscle aches and twitching, which are slowly getting better."
3855,"Folks, drugs can be a wonderful thing but that doesn't mean all drugs are wonderful."
3856,"Please, be carefull."
3857,"Muscle pain, mostly in my legs but to a lesser degree in my arms also."
3858,"Hip pain in my left hip, sometimes severe enough to cause me to limp."
3859,A buzzing sensation in my lower right leg.
3860,This is a fairly recent occurance.
3861,"Severe and frequent muscle cramps, mostly in my lower legs and feet."
3862,Knee pain.
3863,"Generally, I feel terrible."
3864,I have no energy.
3865,"I have constant pain, sometimes severe."
3866,Two days ago I stopped taking Lipitor.
3867,"muscle spasms, body aches, itching."
3868,Had muscle pain in my back (primarily small of my back) and down my leg.
3869,I had tried Lipitor before and the result was achy legs.
3870,"After some time off of this drug and feeling better, I tried it again."
3871,My back hurt so bad that I went to a chiropractor twice and no relief.
3872,I thought I might have a bulging disc but decided to go off the Lipitor again.
3873,"After two months, I'm back to normal."
3874,I call this the drug from hell.
3875,"works fine, but Pfizer is now screwing the American public by denying access to the drug through legitimate Candian pharmacies."
3876,"Therefore, I'm switching to Zocor."
3877,"Forgetfulness, Lack of Concentration, excruciating pain in my legs, insomnia, terrible headaches, itching all over, depression, moodiness."
3878,It dramatically reduced my cholesterol but the side effects aren't worth the benefits.
3879,I went to the medical center today because I was feeling so bad.
3880,I have Lupus so I assumed that it was causing me to feel bad.
3881,"After hearing my symptoms, my doctor told me to using Lipitor for awhile to see if the symptoms go away."
3882,It never dawned on me that it could be the Lipitor.
3883,Now that I found your website I feel so much better.
3884,"terrible neck pain, memory loss is just terrible."
3885,Brain feel kind of foggy.
3886,severe back pain in the mornings.
3887,Extreme fatigue.
3888,Mentally in a daze.
3889,I felt much better 4 days after stopping Lipitor.
3890,I am trying a natural therapy to treat the elevated LDL and I suggest anyone that would like to try this solution email larry @ [larryhor@optonline.net]
3891,It is free and he has no vested interest in the 3 herbs used.
3892,Started getting ocular migranes and migranes during sexual intercourse.
3893,Never had migranes before.
3894,Migranes stopped after stopping lipitor.
3895,Calf muscles (and foot) tire very quickly.
3896,This often leads to leg/foot cramps.
3897,Comparable to fatigue after a long workout.
3898,I have been taking Lipitor for about 4 yrs - the muscle tiring has become worse with time and now will 'act' up very soon even with a short slow walk.
3899,This has severely hampered my ability to excercise.
3900,I first thought this was a response to the diabetes but was recently made aware that Lipitor may be causing it.
3901,Lipitor did lower my chloesterol soon after starting it.
3902,It doesn't seem as effective now.
3903,I'm going to stop taking it because of the muscle fatigue/cramping - hopefully this condition will reverse.
3904,10 mg lowered my cholesterol in the first 6 months.
3905,Continues to decrease with each blood test.
3906,Risk factor is down to 2.2.
3907,"heavy aching legs, especially in the morning."
3908,Never considered it a side effect before reading about it.
3909,Certainly nothing I can't live with unless it worsens and after 10 yrs I doubt that will happen.
3910,4 yrs on zocor then 6 on lipitor(40mg).
3911,Cholestrol went from 300 to 200.
3912,"Tight throat, holding water."
3913,Second time I am trying to live with Lipitor.
3914,"First time was bad, I went with another product which sent me to the emergency room twice, it suffocated me."
3915,"Then I switched to another one which was worse then the second one, kidneys hurt, bladder infection, black outs."
3916,Now I'm back on 20mg Lipitor and will take them regardless of side effects.
3917,"I have low tolerance to any medications, taking the Lipitor at night so I sleep through most side effects."
3918,After a mild heart attack 2 years ago I was put on 10mg of Lipitor.
3919,I began having leg and feet cramps.
3920,I stopped for a month and felt better but my cholesterol went back up.
3921,The doctor insisted I go back on.
3922,When I complained of feet and leg cramps the doctor put me on 5 mg.
3923,This helped but after 3 months my feet are cramping and I wake several times a night.
3924,I am also having back and hip pain and am feeling tired and depressed.
3925,I am going to stop again.
3926,It is not worth going through the pain.
3927,The doctor does not believe it is the Lipitor but I feel better when off.
3928,developed parkinson's disease.
3929,"discovered thru 23andme DNA profiling I possess a mutation in a gene, SLCO1B1, that codes a transport protein responsible for moving statins into the liver to be detoxified."
3930,Studies have noted patients with greatly incrased plasma statin levels (>134% and AUCs more than 400% ABOVE NORMAL) toxic levels indeed.
3931,The neurological damage I have suffered due to toxic levels of lipitor seems to be permanent.
3932,Nothing I have tried has reversed the extreme symptoms.
3933,in the beginning megadoses of coenzyme Q10 did help; that was 6 yrs ago.
3934,the deterioration continues.
3935,"the slco1b1 mutation IS NOT rare, occurring in 26-34% of caucasian poulation, less in african am, and more in Asian pop."
3936,"seems many individuals with the mutation(s) develop severe myalgias and myopathies, prompting discontinuance of the statin."
3937,"for those of us who did not suffer the muscle dmaage, neurodegeneration is what occurs in my opinion."
3938,Am aware of 7 other indicviduals who feel they are sufferring same effects as I from a fat soluble statin.
3939,Very bad pain in left side and buttocks.
3940,Hurt to get up from sitting position; hurt to walk; hurt to stand.
3941,Back pain also but much more on left side at waist area and thigh/butt muscle areas.
3942,Severe numbness in hand such that it wakes me out of my sleep.
3943,"Tingling in feet, soreness in calf muscles."
3944,Occassional sharp shock like pain in head.
3945,I have taken myself off because I can't stand the side-effects.
3946,Never really had high cholesterol but current medical thinking is that lipitor may reverse coronary disease.
3947,I would rather just walk more.
3948,Upon reading all of the reviews how long can it be before there is a significant class action lawsuit to stop this drug from being prescribed.
3949,Muscle pain which I thought was Arthritis.
3950,"After 4 uneventful years on Lipitor, I started having intense shoulder and upper arm pain."
3951,"If I don't stop the Lipitor, what will happen?"
3952,Is this life-threatening?.
3953,"Why aren't we told about the consequences of various side effects of Lipitor, so we can evaluate whether to continue with the drug?"
3954,Why doesn't the product literature mention the possible effects of Lipitor on cognitive function?.
3955,Diarrhea after only one pill.
3956,Unbearable after two.
3957,"I stopped after 2 days, waited 2 weeks and tried again."
3958,Same results.
3959,"I have lots of food and chemical sensitivities, so I'm sure this is not a typical response."
3960,"After taking Lipitor for 2 1/2 years, I experienced problems pronouncing."
3961,"10 MG a day of lipitor and 6 months later I have extreme leg pain in the calves after just walking a few blocks, in a brain fog with memory loss, Vision is giving me problems and feel like shit all the time."
3962,This drug should have a pre-qualifier before perscribed or better yet.
3963,take all the statin drugs off the market.
3964,This drug is dangerous.
3965,I'm almost inspired to start my own web site to warn people of the risk in taking any statin drug for a quick fix.
3967,"Vertigo, room spinning , dizziness, nausea, vision problems - seeing two or three of everything."
3968,None whatsoever.
3969,I'm glad someone out there is listening.
3970,This is.
3971,I have had tendonitis in my knees and troublesome pain in my lower legs and feet.
3972,"My knee swells with fluid, so that any movement causes excrutiating pain."
3973,"At first, I thought that this might be gout, because it runs in my family, and my toes swell up occasionally."
3974,"But, after my doctor confirmed that my swollen knees were not gout, I began to consider other causes."
3975,It dawned on me to check the internet concerning the Lipitor I have been taking.
3976,"Sure enough, many people have the same troubles."
3977,I used to be able to walk for endless miles.
3978,"For about the same amount of time I have been taking this drug, I have been hobbling around, cautious of every painful step."
3979,"Although it may lower my cholesterol, tomorrow, I will stop taking the Lipitor."
3980,"muscle weakness causing nerve damage and imbalance; stiffness similar to arthritis, s l o w walking and numbness."
3981,on 10mg tightness and fatigue in forearms and legs.
3982,Pain in side muscles on one side of chest.
3983,Off balanced-ness.
3984,"However, I started to have these symptoms to a lesser degree two weeks before I started the Lipitor due to a viral upper respiratory infection."
3985,These symptoms increased with Lipitor and lessened when I went off it.
3986,Wondering if metabolic changes battling high cholesterol is the cause rather than the drug formulation itself.
3987,I will try taking Co-Enzyme Q to moderate side effects.
3988,I also take Zinc and Omega 3-6-9 capsules (which lowers cholesterol).
3989,"Stomach pain, Gas, Burping, Diarhea."
3990,I called the doctor today to report my issues.
3991,I am waiting on him to call back.
3992,Looks like I will need to get off of Lipitor.
3993,The stomach pain comes and goes and can become quite uncomfortable.
3994,tendonitis.
3995,"I have not been takeing Lipitor very long it has only been a few weeks and my Dr has me taking it twice a week but since I have been taking it my right hand has been getting numb and hurting it feels like there is no circulation getting to it and after reading all of this it is probally the lipitor, I am very worried now after reading all of this and feel I should quit taking it."
3996,"serious hands & feet cramping, weakness, painful inflamation of joints/knuckles and significant strength reduction."
3997,persistent feeling of tiredness and overall muscle soreness/weakness/fatigue.
3998,All symptoms worse upon waking.
3999,I significanlty lowered my chol by using 10mg lipitor and excercising.
4000,"However, for months I attributed all my pains to my busy schedule and my exercise routine."
4001,"I went from a 36 year-old who can do 60 min of cardio/45 min of free weights every other day, to someone who can barely pick up his 15 mo. son."
4002,My life right now is a disaster.
4003,I've been off it 2 weeks and the pain has only subsided 20%.
4004,I can barely walk when I wake in the morning.
4005,I cannot get anything done around the house.
4006,My life right now is depressing until I get back to normal.
4007,All exercise has ceased and my wife picks up the slack for chores around the house that I cannot do.
4008,I HAVE NEVER experienced symptoms like these in my life.
4009,I am hoping this goes away soon and doesn't cause any long term damage.
4010,I cannot say that I'd do it over again.
4011,"In fact, at my risk, I doubt I'll take any meds willingly if I can."
4012,Drug companies really downplay the side effects.
4013,"I know how this goes, I work with stats too!."
4014,"slurring in speech, lower back pain, bloated, constipated and severe hip pain on both hips."
4015,"Memory loss and fatigue and muscle weakness and depression, and sleepless nites."
4016,Sight loss and very off balance.
4017,"This is so weird, I came on this site due to wanting to know why I was having the hip pain and feeling like ."
4018,! This is the 2nd time I got on Lipitor.
4019,"Dummy me, got off cause I was not feeling good taking it and was going to have surgery so I got off a couple of months after taking it a couple of months and did feel better."
4020,"Both times I have taken Lipitor, I have gotten some lower back pain (almost like a disc out of place)impossible to move."
4021,"After reading this, I am sure that Lipitor is causing all this."
4022,I did feel better health and mood and no pain before I started taking this Lipitor both times.
4023,I am amazed that it didn't dawn on me.
4024,Have a 5 month supply but getting off quick!.
4025,"severe edema with swelling of limbs, vision problems, weakness, muscle pain, rhabdomyolysis/muscle loss, rapid pulse, cough, poor coordination while walking, dizziness, difficulty sleeping, increased sensitivity to other drugs, sweating, nausea, frequent headaches, numbness/tingling?aching/ heavy feeling in limps, difficulty walking due to swelling in legs and problems with coordination, fatigue, increased."
4026,I was told that what I went through was a rare experience for people on Lipitor and other statins; but I had two reactions this past year to Lipitor first and then later to the Pravachol my Dr switched me over to.
4027,I can't remember how long I was on Lipitor (maybe 8-10 months).
4028,I was on Pravachol for 2 months when I ended up with similar problems.
4029,Stopped statins 4 months ago.
4030,still having a lot of problems but there was a dramtic decrease in symptoms after stopping both the Lipitor and the Pravachol.
4031,after one week i started with chest tightness and numness aching feeling to my left arm also pain inbetween both shoulder blades .
4032,also would wake up feeling shakey headache and just more tiered.
4033,called my dr.
4034,he said to stop takeing it.
4035,so now i must lower my cholesterol with diet and exercise.
4036,not for all .
4037,"Weakness, cramping, muscle spasms."
4038,Slurred speech and difficulty swallowing.
4039,Have recently been diagnosed with ALS.
4040,I blame lipitor.
4041,"Severe muscle pain in shoulders radiating through the chest, cramping in back muscles, calves and hamstrings."
4042,"Severe muscle pain after working out with weights, all the while losing strength."
4043,Difficulty with memory at times (i.e. remembering a name or a word).
4044,My shoulder pain resulted in a visit to a specialist who said inflammation was present but no torn rotator cuff.
4045,Prescribed physical therapy which made it hurt even more.
4046,I first noticed the pain several months in to taking the drug.
4047,"After an ER visit due to severe back spasm/cramp, my Cardiologist suggested going off the drug and in the past 10 days, no cramping, the shoulder pain has eased 80% and I actually feel good."
4048,Because of blockage issues I need to move on to another drug like Crestor or Zocar but after reading some of the comments I am concerned.
4049,The medication worked at lowering my cholesterol (127 with good cholesterol over 40 and bad cholesterol under 70) but at a steep price physically.
4050,"After about 4 months of taking Lipitor, one day while walking, my left leg, below the knee, experienced intense pain and stiffness."
4051,"Symtoms have persisted for a week and after reading the comments on this board, I am stopping it."
4052,"While it worked well by lowering my cholesterol, I had no idea this was a side affect."
4053,So sad to see so many with problems like mine!
4054,"Progressively worsening problems with joint pain, muscle pain, depression and tiredness."
4055,"Doctor has ran all sorts of tests and oculdn't find anything wrong, everyone was pointing to arthristis."
4056,I stopped taking Lipitor and many of the problems went away after 2 days.
4057,I'm not going back to it.
4058,"Not sure if related, but increase in burning sensations in legs and hands started around the time this drug was added to my list."
4059,"weakness, tired all the time, leg, arm and back pain, not concentrating well, flu symptons randomly every few weeks, bad dreams a lot, purple sploches around waist."
4060,I know that it works but I would rather feel like my old self as I have always been active and love exercising but on this medication I have to make myself get out and walk and go to my gym classes.
4061,"Zocor [1 yr], then Lopid [1 yr], then Lipitor [5 yrs]."
4062,"muscle atrophy, legs & Arms; pain in shoulders."
4063,Discoloration of skin [blotchy] on the neck.
4064,Short term memory loss.
4065,Flatulance.
4066,"Lowered LDL & trigylcerides, but also lowered HDL."
4067,Started taking 10mg of Lipitor.
4068,LDL raised about 5 points and Cardioligist doubled the dosage.
4069,Several years at 20mg really took its' toll.
4070,"Stopped Lipitor, tried taking red yeast rice [natural statin] [1-600mg capsule]."
4071,"RYR controlled cholesterol, but is still a statin - similar side effects."
4072,I had a chronic backache that kept getting worse.
4073,I complained about this for some time finally a doctor scheduled me for a MRI.
4074,"The results indicated I have arthritis so I accepted that and attributed the aches to simply getting old, (69 yrs)."
4075,Two weeks ago it got so bad that I stopped my regular exercise.
4076,"About a week ago, in the middle of the night after taking my usual Lipitor dose, while making my nightly trip to the toilet, a severe muscle back cramp almost sent me to the floor."
4077,"After finishing my business, I hardly could sleep that night."
4078,As I got out of bed that morning I started getting severe muscle spasms in the same old place.
4079,"The spasms lasted most of the day and gradually the intensity, frequency and duration diminished."
4080,"Since I had done nothing recently to cause a cramp or spasm, and realizing that in the past, the back aches usually were the worst in the morning but got better during the day and best at night just before my Lipitor dose, I suspected Lipitor."
4081,I quit them 7 days ago and my back has not been this good in months!.
4082,I had been taking Lipitor 10mg for 2 years.
4083,"About 6 mons. ago, I decided to tell my Dr I was having muscle pain and leg cramps."
4084,He switched to Pravachol 20mg.
4085,I lasted about 2 weeks.
4086,The pain was worse.
4087,Then I decided to look on the internet to find out what was causing the pain.
4088,It was Statin.
4089,I looked that up and found what it does to the body.
4090,"So, I decided to stop taking any drug and take some Q10 to build my body back up."
4091,Two months later went back on Lipitor with the Q10.
4092,"2 months later, the pain was back."
4093,"Twice as bad as before, plus a whole bunch of other side effects, you see I'm seriuosly allergic to the Statin."
4094,"And I know now, why I should have known this, but no one told me about it."
4095,When you are taking Statin and drink alcohol the side effects increase dramatically.
4096,"When ever I drank, sipped a little wine, by body hurt so bad, I thought I had the flu."
4097,"And no Aleve, or pain killer would help."
4098,I thought I was allergic to the alcohol.
4099,But now I know it was the Statin.
4100,"Here are a list of the side-effects I had, that started slowly and in two years, became unbearable: Insomina,abnoraml dreams, depression, memory loss, photosensitivity, muscle pain, leg cramps, rhinitis, bronchitis, asthma, dry skin, tinnitus (left ear) taste loss, dry eyes, weight gain and finally hypertension."
4101,"During the two years, I was on the Lipitor, all these syptoms started out slowly."
4102,First came the tinnitus.
4103,My Dr sent me to the ear Dr.
4104,"Found no problem, I would have to live with it."
4105,"Second, came depression, Dr put me on Zoloft."
4106,"Then came the sinus problems, Dr put me on Rhinocort."
4107,During all this I felt like I was 80 years old.
4108,"My neck hurt, my hips hurt."
4109,"We got a $3,000.00 sleep by number bed to relieve the pain."
4110,Didn't really help.
4111,Insomia was constant.
4112,I got hooked on Tylenol PM.
4113,I gained a lot of weight.
4114,"Went to Lindora to loss weight, so I could get off the Lipitor."
4115,Lost 40 lbs.
4116,Dr said to stay on Lipitor for prevention.
4117,This is when I decided to check it out on the internet.
4118,"When I went back on the Lipitor, about 2 months ago, I had a small drink of wine at a wedding."
4119,"That night my body aches were so bad, I could hardly stand it."
4120,"Then two days later I came down with bronhitis, and asthma."
