1913,"Then started with excruciating pain and muscle cramps in lower back,then down left buttock, thigh,calf and ankle."
1914,"Left foot has a numbness feeling to it,tingling in lower leg when walking,which I have to use a cane now."
1915,"Also very fatiqued,buzzing in both ears, nausia, sleeplessness, gas and dark urine."
1916,All these side effect I have 24/7.
1917,"I have asked my doctors more then once if any of my meds. could be causing me all this pain,3 different doctors said NO."
1918,"They came up with, Arthritis,Tendonitis,Sciatica,after being checked out for all these, they were wrong."
1919,I stopped taking Lipitor and Tricor about 6 weeks ago.
1920,"took Lipitor for over a year with no negative effects, then gradually developed terrible joint pain, couldn't move shoulders, hips hurt, had to push out of chair like old person."
1921,"stopped taking it after almost 2 years; it really lowered cholesterol, but at cost of terrible joint pain, loss of sleep, shoulder and hip pain and loss of range of motion."
1922,"Stopped, and pains lessened in one week; took months for it all to go away."
1923,"Bloating - GI difficulties, added weight, weakened muscle noticed in arms but not legs."
1924,Prescribed 20 mg Lipitor for cholesterol.
1925,Took liver test (ok I guess - no response from doctor).
1926,Took 25 days and decided otherwise.
1927,Will go back to herbal and vitamin sources.
1928,Don't trust side effects especially memory difficulties and muscle-joint degeneration that some researchers say.
1929,"On the third day taking just 5mg, stomach cramps and loose stools set in."
1930,"Gas, bloating and fatigue followed."
1931,Just wanted to sleep.
1932,Couldn't exercise or eat.
1933,Started using anti-acids for the first time in 15 years.
1934,"Three weeks after quitting the drug, the symptoms persist."
1935,"I am 41, male, taking no meds (except 72 hours of Lipitor), with no history of smoking, diabetes, etc This drug (or class of drugs) is potentially very nasty."
1936,"Massive hair loss, extreme joint stiffness (esp in my right knee - it would just lock-up), heart palpitations, heavy depression, skin and eyes swollen and itching."
1937,I have taken it for a long time and only in the last year have these symptoms occurred - perhaps these are long-term usage effects.
1938,I don't know why this drug is even being allowed to be sold!.
1939,"I've been taking LIPITOR for a few years (had been on Baycol),."
1940,"a couple of years ago, I began experiencing increasing joint and muscle pain that is now so severe that I am wodering if it's worth living with such pain."
1941,I'm very depressed.
1942,"The pain is often so severe that it limits my ability to walk and climb stairs, to lift anything heavier than a few pounds."
1943,"I've had some excruciating thigh cramps, and more recently, I have noticed a generalized weakness all over my body."
1944,"It scares me to stop taking some statin drug because my cholesterol was very high without them, but my quality of life is so drastically affected that I think I have to."
1945,I believe it's very dangerous stuff.
1946,"After taking drug for 10 days, I noticed a complete loss of taste for salt and sugars."
1947,Good food tasted bad or no taste at all.
1948,Taste perversion seems to be the term.
1949,Breathing air tastes sweet.
1950,It has taken 8 months for my taste to return to normal.
1951,Would not recommend it.
1952,Started out with fatigue/depression and was diagnosed with fibromalgia.
1953,Then came the extreme knee pain followed by hip pain.
1954,"On top of this perpetual pain, I started having the irritable colon acompanied by three years of diarrhea that was diagnosed as colitis."
1955,I recently was totally dibilitated by swelling and pain in my hands.
1956,My family convince me to stop takng the Lipitor after my daughter found this site and after 4 DAYS - no swelling and the pain has subsided!!!
1957,I am interested in trying some of the natural options stated in this site to see if I can control my cholesterol (270 at the highest.
1958,Thanks to everyone who has enlighted me!!!.
1959,Time for the government to look into this drug.
1960,Don't you think it is interesting that the medical field has recommended that your cholesterol should now be 170 when just a few years ago 200 was good enough??!!
1961,Sounds as though the phamacuticals companies need to sell more statins.
1963,"Severe back pain, flank pain, hematuria, kidney failure."
1964,This was the worst drugs I could ever have taken and could not possibly recommend that anyone take it.
1965,Lipitor caused permanent liver and kidney damage to me and is a killer.
1966,"Sleeplessness, tingling in fingers."
1967,General foggy-headedness.
1968,Took the drug for several years before realizing that lipitor might be the cause of these symptoms.
1969,Stopped and started several times with recurring side-effects.
1970,Discontinued.
1971,Reduced chol from 300 to 160 (29 yrs old in great shape just genetically high).
1972,Miracle drug- until year 3.
1973,Leg began having vibrating sensation (kept thinking cell phone was in pocket but it wasnt).
1974,Entire body ached; toes felt arthritic; had problems with memory & coordination (fell down stairs # of times).
1975,Stopped and all symptoms have gone away.
1976,Experienced same issue w/ all Statins- not just lipitor.
1977,The worst gas I've ever experienced!
1978,"I mean smelly and painfull! Diarhea, headache, backache, runny nose."
1979,1 week on 40mg.
1980,Am stopping it now before anything else happens!.
1981,Why did my doctor start me on such a high dose?
1982,No warning of these side effects- I mean the gas and bloat is so bad I can't go to work.
1983,lethargy and leg soreness.
1984,"Muscle twitching, stiff neck, constant lightheadedness, always worrying about a brain tumor or something."
1985,I found this site and it looks like my problems may be the Lipitor.
1986,Doctor refering me to a nuerologist for twitching and light head.
1987,will ask about possibility of Lipitor.
1988,Lowered my Cholesterol from 255 to 173.
1989,"Severe muscle pain and movement restriction, hand tremor, memory deficits, worsening cataract, gum infections."
1990,"Improvements noted two weeks after discontinuing, did not regain full range of movements in arms for two years."
1991,Pain in shoulder and arms and hands.
1992,Hands are often numb and very weak especially in am.
1993,I thought it was carpal tunnel syndrome.
1994,Having difficulty opening jars.
1995,"I ran marathons in 01, 02 and 03."
1996,and I have been a regular at the gym until about a year ago when I started lipitor.
1997,"Recently, I noticed that I could not do a single push up without severe pain."
1998,Playing basketball has become impossible.
1999,Even a simple pass causes significant pain.
2000,The pain in my arms interrupts my sleep.
2001,"I thought that I was just aging and/or out of shape, but it might be the lipitor."
2002,I am going off the medication and trying CoQ supplements and vitamin C to see if this helps.
2003,Muscle aches.
2004,Vision severe impairment in a.m.
2005,and pain and heaviness in eyes that were hard to open in morning felt like the eyes had blown up overnight.
2006,I did not want to get up in the morning because of the eye pain.
2007,"general weakness, decreased stamina."
2008,Immediatly reduced my cholesterol.
2009,Over the 12 years my health has weakened in many ways that I noticed some of you other posters have mentioned.
2010,Is it because we are aging?
2011,Or the drug?
2012,Symptoms.
2013,here goes.
2014,Depression.
2015,Back surgery but the afterpain was unexplained?
2016,Maybe Lipitor?
2017,Hips are sore and lower back pain.
2018,Vision reduced greatly.
2019,Hair loss.
2020,Tired most of the time.
2021,Can't get to sleep and then can't get out of bed till late morning or midday.
2022,No strength.
2023,Loss of breath.
2024,"So if a person goes off this, what is the drug alternative to keeping the cholesterol down?"
2025,I am thinking of stopping the lipitor and going on a diet to prevent the cholesterol from rising.
2026,Any other suggestions would be greatly appreciated.
2027,Good luck to you all.
2028,"severe muscle pain in hips, legs and ankles."
2029,"It helps lower my cholesterol, but recks my muscles severly."
2030,I take a 6week break and resume dosage of lipitor.
2031,Big problems with muscle cramps and numbness in my legs progressing to difficulty walking up stairs and swollen feet and ankles.
2032,Some of this could be other meds or combinations but I didn't have these problems before starting Lipitor.
2033,Statins are supposed to be the new miracle drug to keep us all alive for years longer.
2034,What a joke.
2035,Who would want to live like this?
2036,I have been off all my meds for about a week and feeling much better.
2037,I know it's dangerous but so are the drugs.
2038,"general weakness, reduced stamina, tennis elbow in both hands."
2039,should only be taken by people with 300+ levels.
2040,"SEVERE AND UNCHARACTERISTIC DEPRESSION, ANXIETY, AGGRESSION, AND MOOD SWINGS."
2041,I cannot stress this enough- my personality comepletely changed after beginning this medication.
2042,"I am typically an easy going, positively thinking, emotionally stable, and motivated person."
2043,"But after starting Lipitor I've gradually descended into a world of extreme anxiety, hopelessness, lonliness, and self loathing."
2044,"I've never in my life been so depressed, so obsessively focused on morbid, terrifying thoughts, or so negative about everything in my life."
2045,"After being off of this medication for only 48 hours, I am already beginning to see an improvement in my moods, but this will be a long journey back to my old self, I feel."
2046,"Oh yes, and I also suffered from: Gas, Constipation, EXTREME FATIGUE, weight gain and bloating, and occassional bouts of diaharrea."
2047,"It lowered my cholesterol, to be sure."
2048,But it also significantly lowered my quality of life.
2049,This website has been an absolute lifeline for me.
2050,My doctor had seemed so completely unwilling to accept that my symptoms could've possibly been related to my taking Lipitor.
2051,"However, I know my body and know when things are not as they should be."
2052,I have been feeling this way since almost immediately after I took my first dose.
2053,Hearing that so many other people have experienced the same exact symptoms as me has given me the courage needed to STOP this medication.
2054,"So many of my family members and friends have had bad reactions to this stuff- I can not trust it, and will be looking for another way to get my cholesterol under control, if possible."
2055,Be very careful and very informed before you start any new medication.
2056,Don't always trust the word of your doctor as the only word and take it at its face value.
2057,"When it comes to your body, you have every right to dictate, understand, and call the shots about what does and does not go in to it."
2058,Very effective.
2059,Lowered cholesterol from 230 to 160.
2060,Spleen Cancer and ALS patient.
2061,Took this drug for three years right after it was released -- bottom line lost all ability to control hands and muscle weakness.
2062,There is no history of ALS in my family.
2063,Currently being treated at Duke Medical Center.
2064,Tingling all over my body and numbness.
2065,"Having been on Lipitor for over one year, with a modest reduction in cholesterol levels, I developed a severe reaction following shoulder surgery."
2066,"Approximately 4 months following my surgery, I developed an abrupt and chronic pain in my arms, hands and the back of my upper legs (from buttocks to knees)."
2067,"After two MRI's and EMG and blood and urine analyisis reviewed by a Neurologist with negative and/or normal results, I self-diagnosed having read numerous patient complaints mirroring my symptoms and reading a cautionary warning to physicians to consider taking their patients off Lipitor when the patient was scheduled for major surgery (www.drug.com)."
2068,My Neurologist has prescribed Prednisone 10mg to help with the symptoms.
2069,I am trying to limit my use of the Predisone but cannot take care of basic functions without a minimum of 10mg daily.
2070,"As a CEO of a large sales company and a physcially active person, I'm extremely concerned about this chronic condition."
2071,I have been off Lipitor f.
2072,"Thyroid disease (not sure if Lipitor caused), vision problems (blind spot in right eye), hives, severe pain in left shoulder, arm, and hand."
2073,Muscle atrophy in left shoulder so bad that I cannot lift objects.
2074,Bad gas and constant diarrhea.
2075,Memory loss and difficulty concentratiing.
2076,These symptoms (except for the blind spot) manifested gradually after several years on Lipitor.
2077,"I stopped 1 week ago, and the symptoms have seemed to stop worsening."
2078,"I am hoping for the best, as my quality of life has suffered dramatically."
2079,"muscle aches and weakness, nearly bed ridden over it and soon after they took me off I had a high sugar attack and have been on insalin ever since."
2080,"vision problems, stiff neck symtoms, nerve pain and weakness in forearms from the elbows to the wrists in both arms with pain."
2081,"took it with co q 10, vitamins, and bp med prinivil,estratest, actose,and flaxseed daily high fiber diet; lowered choles. from 228 to 123, triglycerides from 180 to 79, hdl from 53 to 58, and ldl chols. from 138 to 38."
2082,after only six weeks with very moderate exercise.
2083,"Lipitor did help lower my cholestrol, but has caused other health problems not listed in the side effects."
2084,"I have had digestion problems since I have started taking this, my pancreas is very swollen."
2085,"I have been through every test possible, and they cannot find anything wrong with me."
2086,"I have lost 35 lbs, and have recently just heard that this has happened to other lipitor patients."
2087,"I stopped taking it, and feel better already!."
2088,Please email me if you have had similiar problems.
2089,heel pain goiing into my ankle.
2090,heel is hot and feels like i am walking on a stone.
2091,when i go off off the lipitor for a few days it gets better.
2092,i took this for 6 months 20 mg and did not have a problem but my coalesteral went back up to 250 even though i am not a big meat eater.
2093,iI have been on it for 4 months this time.
2094,i am going off it for good and see if my foot gets better.
2095,it has bothered me for 2 months thought I had the goat.
2096,I am 74 female and not a drinker or eat rich food.
2097,"I HAVE MUSCLE SORENESS IN MY LEFT LEG ALSO MY HIP, PINS AND NEEDLES, INSOMNIA, NECK PAIN, NOW A SPUR IN MY RIGHT HEEL PAD, WEIGHT GAIN, TRUBLE REMEMBERING SOMETIMES, WHEN I WRITE MY HAND FEELS LIKE IT'S NOT MINE LIKE I'M WATCHING SMEONE ELSES HAND, ODD FEELING THAT."
2098,"TIREDNESS, DEPRESSED AS WELL."
2099,Not sure--I'm taking several medications so I don't know if the others may cause some minor side effects.
2100,10 mg dosage lowered cholesterol from 170 to 31 from July to Nov 06!
2101,I did change my diet also from almost no beef to almost entirely chicken and avoided butters/margerines.
2102,I am now on 5mg dosage and niaspan to raise HDL.
2103,"Extreme fatigue, muscle aches, cramps, MEMORY problems, balance problems, cold toes and feet (with NO circulatory problems) cold hands, dry throat/hoarseness, slurred speech."
2104,"Lipitor works, but for me it was at a terrible cost to my quality of life."
2105,"At first, I had no problems."
2106,Problems began gradually and I never put it together until my GYN said STOP taking Lipitor!
2107,"Over this time, I gradually began to feel like an old, old lady and I was taking medication for arthritis and being tested for sorgren's syndrome."
2108,I was also joking about developing alzheimers but was really terrified of my memory problems and slurred speech!
2109,My internest never suggested it could be the lipitor.
2110,I've been off 1 month and it's been like waking up from a bad dream.
2111,Every day has been better.
2112,I hope it continues!!
2113,I took CoQ10 along with it.
2114,NEVER Again!!.
2115,Initially minor muscle pain but thought it was due to my working out.
2116,After two years of use - SEVERE muscle pain in sholder and hip joints - random fluish feeling (minor muscle achs all over)- random low energy.
2117,"Within two weeks of this sudden increase in pain, I was waking me up at night in pain."
2118,Pain immediately declined within a few days of stopping lipitor.
2119,Won't touch it.
2120,I don't know how long it will take for my muscles to heal now.
2121,"Intermittent temperature elevation, chronic diarrhea, and severe joint aches similar to abdominal flu symptoms."
2122,Lasted the duration of my Lipitor history (6 weeks).
2123,Of note is my history of cholecystectomy (10 years ago) and osteoarthritis.
2124,always feeling tired.
2125,high priced.
2126,"Muscle tightness, cramping in legs and back."
2127,Problems sleeping and concentrating.
2128,felt like I had the flu much of the time.
2129,Irritable.
2130,I had no perceptable symptoms for about 6 months.
2131,"Since this was the only medication I was taking, I quit it and started feeling better within a week."
2132,It took about 3-4 weeks to completely recover from this medicine .
2133,"I tried other statins, but had similar bad side effects."
2134,"sever muscle weakness with nerve damage,memory loss,red spots all over my body,hair loss,slowed speach,aphasia brain not sending messages to my muscles,shufflihg gait,unable to get out of chairs without help."
2135,"Itook Lipitor for ten plus years 10mg then Dr raised it to 20mg and about 2 weeks latter raised it to 40mg I took 4 pills and I could not walk,get out of a chair, put my hand up to my mouth,ringing in my ears, sinus problems,I was told the pain in my back was galblader when I had it removed 20years befor."
2136,I ask my Dr about my hairloss and spots on my body&was told [Your age]whenI lost my ability to walk very far I ask my pharmacist what drug if any would cause this she said stop the Lipitor and get to your Dr a.s.a.p.
2137,"I stopped the drug 5weeks ago and have been in physcle therapy for almost 5wks with some help but the weakness comes & goes from one side to the other& back again .I have aphasia intermittingly, My eyes get blury My brain is going on overload right now so I pray that someway some how this killer drug gets off the market befor any more trusting souls get simptoms of unsuspected side effects."
2138,After reading all the side effects and looking back on all my proble.
2139,My chloresterol was 220 and my physician prescribed Lipitor.
2140,I took the medication for 3 weeks before I stopped.
2141,"My left side, especially my shoulder and arm, are so sore and it's been a year since I stopped taking it."
2142,I'm concerned I have some kind of permanent damage to my muscles.
2143,I have no strength in my left arm and have a painful time lifting my own arm above my head and holding a hair dryer is a major task.
2144,My left hip hurts and I can no longer sit crosslegged on the floor.
2145,I am very limber but I cannot sit that way anymore and cannot get up from sitting on floor without a struggle.
2146,"I wondered, at first, if I had some kind of mild stroke but found this website and realized I was right, it was the Lipitor."
2147,"I lowered my chloresterol by eating a bowl of oatmeal at night, for me, just changing my diet was the trick."
2148,Extreme fatigue and general weak feeling overall like I have never experienced EVER in my entire life before.
2149,"In all honestly, I feel as though my sense of well being has taken a sudden decline after taking this medication for only two weeks."
2150,I intend to phone my M.D.
2151,this morning about discontinuing this medication.
2152,"involuntary movements,muscles aches specially in back of legs, muscle weakness,, knee pain, neck pain,headaches,concentrating, blurred vision,back pain,difficulty to walk,I stop it since 10 days but i don t fell better do u know how long it take to be better?"
2153,and what is possible to do?
2154,hope to have answer.
2155,8 mois lipitor 40 mg.
2156,"fatigue and extremely high sleep requirement,pain and loss of support in calf musells, unable to walk,vertigo like attacks at night while in bed, loss of any sex drive(not complaining),ability to think ahead improving,."
2157,"add on to 11/8/2006 report, been off lipitor for about 27 days sleep requirement went from 14 hrs to 8 ,still some fatique leg support weak but able to walk general mussel weakness persists with mild improvement,vertigo decreased no attacks balance not as good as it use to be, hope some more of my energy returns, exercise sessions indicate a recovery to 29% from 5% relating to pre attack exercise levels."
2158,"GRADUAL BUT SIGNIFICANT INCREASE IN SLEEP REQUIREMENT AND ENERGY LOSS,LOSS OF CALF SUPPORT IN LEGS,VERTIGO LIKE EPISODES,COMPLAINTS TO DOCTORS WERE TO NO AVAIL, CONVINCED ME IN ERROR."
2159,"AFTER GOING OFF THAT GARBAGE WITH IN TEN DAYS SLEEP REQMT WENT FR 12 TO 7 HOURS, ENERGY LEVEL INCREASED DRAMATICALLY, LEG PAIN WENT AWAY, STRENGTH IS RETURNING, VERTIGO LIKE SYMPTONS DECREASING, LOOKING TO JOIN CLASS ACTION SUITE."
2160,Aches and pains everywhere.
2161,Gradually diminished mental acuity and felt depressed.
2162,Side effects came on slowly so I did not think it was the statin for quite a while.
2163,Bad side effects took about a week to 10 days to disappear after I stopped taking it.
2164,Will NEVER take another statin.
2165,"No side effect for first 4 weeks, cholesterol down to 150 from 210, then unusual pain and weakness began in both legs, worse on left."
2166,Worse with exercise.
2167,"Legs felt cramped and sore and weak, especially in calves and lower rear thigh muscles."
2168,"I had been a regular and energetic walker, but I couldn't keep it up."
2169,My blood work showed mildly higher levels of whatever is watched for with this drug.
2170,"The doctor left it up to me whether to continue, and I stopped taking it about 3 weeks ago."
2171,"My leg pain seemed to improve after about a week but did not go away, and has now worsened again."
2172,I this drug should be used with far more caution!.
2173,"Elevated CPK levels, muscle problems, felt bad."
2174,"I landed up having to have a muscle biopsy to the right leg which showed no muscle damage, but elevated CPK levels still were present."
2175,"After stopping this drug, the levels returned to normal after 3 months."
2176,"fatigue,neuropathy, taste perversion, back pain,suicidal depression,weight loss, paranoia,general change in personality."
2177,Everything in my career and family life was going fine for me but a feeling of impending doom persisted in me.
2178,I do not think that enough long terms trials are done on this drug.
2179,Patients often struggle with its side effect and their experiences are not validated by physicians.
2180,None.
2181,Lipitor dropped my cholesterol from the 260-280 range to the 160-180 range.
2182,"Oddly, only positive."
2183,I seem to sleep better and have lots of interesting dreams.
2184,No adverse effects.
2185,"Was on Niacin (500mg) for 90 days, but showed no improvement."
2186,"Tried Tricor for about 8 days, but couldn't deal with the side-effects (sore joints, sleeplessness, gas)."
2187,"Been on 20mg Lipitor for 30 days now, but won't know any benefit for another 60 days."
2188,"deppression ,weakness, fatigue, muscle pain and stiffness in neck,numbness and tingling in extremeties,gas ,bloating indegestion,stuffy nose,plugged ears,lack of balance and cooridination,kidney stone,bronchitis, increased cough, abdominal hematoma from bleeding in my abdomen after coughing and rupturing a blood vessel."
2189,"decreased immune system ,elevated wbc,s,trouble swallowing,hoarse voice,chest pain shortness of breath,decreased sense of smell and taste,irregular periods abnormal uterine bleeding , decreased progesterone production,dark urine,tooth decay,anxiety,anemia,back pain."
2190,I felt like I was being poisoned for the 3 years I was on it esp.
2191,the last several months after my dosage was increased to 40 mg.
2192,and I was being poisoned!!!
2193,by lipitor!!
2194,"I have been off it now for 9 months and feel much better but still have residual side effects a constant vibrating down left leg, muscle and joint pain on and off still never got back all my smell and taste and still not making progestero."
2195,I have been a nurse for the past 25 years and have seen the devistation of these dangerous over perscribed drugs every day I go to work.
2196,"The increase in kidney failure from patients on it the increase in infections ,auto immune diseases , and the over all ill health of these patients increased confusion muscle pain and weakness trouble walking increased bleeding in patients on statin drugs."
2197,"I have headache, muscle ache, diarrhea, indigestion, abdominal pain, back pain, eyesight has changed sinus problems, joint pain, leg cramps."
2198,I have fibromyalgia also and my pain should be at a lower level instead of worse.
2199,I am stopping this on my own tomorrow!
2200,My doctor never even suggested diet first!.
2201,"Muscle weakness in arms and legs, blurry eyesight, hair loss, but worst of all, burning feet and painful heels."
2202,Taking the drug did lower my cholesterol and after 9 years my liver enzyme tests suddenly were in a good range.
2203,I believe a good diet can do more for me than Lipitor.
2204,"Confusion, short term memory loss, lack of motivation."
2205,Returned to normal within a week of quitting Lipitor.
