0,"I feel a bit drowsy & have a little blurred vision, so far no gastric problems."
1,"I've been on Arthrotec 50 for over 10 years on and off, only taking it when I needed it."
2,"Due to my arthritis getting progressively worse, to the point where I am in tears with the agony, gp's started me on 75 twice a day and I have to take it."
3,"every day for the next month to see how I get on, here goes."
4,"So far its been very good, pains almost gone, but I feel a bit weird, didn't have that when on 50."
5,Hunger pangs.
6,"Brilliant, I have a new lease of life, i walk up & down steps properly, no longer sideways like a toddler, hip pain as gone other than if i jar it."
7,no side effects for the first two months .
8,then vaginal bleeding 2 wks after menstral cycle.
9,stomach pain.
10,canker sores in my mouth.
11,headache.
12,been off for 1 week still have bleeding.
13,helped my pain alot .
14,too scared to take this drug again.
15,"1st pill taken with food, a few hours after i experienced shortness of breath, a sense of depression, cramping, upset stomache will stop taking immediately."
16,"Honestly can not recommend this drug, I am still experiencing side effects just after 1 pill and im supposed to take twice/day 75mg."
17,I just cant keep going have to try something else.
18,"I have had no side effects been taking Arthrotec a little over a year, have not noticed any side effects."
19,It does help alot I noticed that when there are times when I forget to take it I can't stand or walk for any lengths of time.
20,It seems as if bleeding forever is a side effect but doctors tell you that its not the drug
21,I have been on Arthotec for Three months I still have pain and stiffness
22,at first week into this drug I was in so much pain I sat on the floor at work and thought I was gaving a baby.
23,I always feel weak and almost fainted a bunch of times.
24,Consider somthing that works I am switching today as this isnt in my head.
25,"some diarrhea, some constipation, fatigue."
26,it works very well for the heel; I couldn't walk on it very well before taking it.
27,I take 75mg.twice a day.
28,"Also have severe osteoarthritis in the knees and hands, but it doesn't seem to relieve that pain at all."
29,"I've been on 75mg twice daily for 13 days, with recent body swelling, face, wrists, abdomen, thighs - clothes fit tight."
30,Insomina is much worse.
31,I have forgetfulnes and confussion - really bad - almost dangerous.
32,"Have felt ""empty stomach"" feeling, but not bothersome."
33,"Have had more loose stools, but tolerable."
34,"I'm looking for a more natural therapy, checking into HA (Hyaluronic Acid) to replace Arthrotec."
35,none that I can think of.
36,I recently had bilateral knee replacement.
37,"Prior to that, Arthrotec was the only drug that helped."
38,"I tried every drug on the market,but, to no avail."
39,I took 50 mg. 3 times a day of Arthrotec and was almost pain free.
40,I highly recommend it to anyone that suffers from arthritis.
41,Hospitalization due extreme rectal bleed that required blood transfusion.
42,I was extremely sick and initially felt I might not survive.
43,Should be removed from market.
44,"Abdominal pain, Dizzieness and blood clots in urine which caused problems with urine leaking."
45,I stopped the Arthrotec twice and restarted but the same symptoms came back.
46,I will not take this medication again.
47,Upset stomach and the feeling that I may need to throw up.
48,The pain in my stomach is in the middle of my stomach above my belly button and its a deep constant pain.
49,"I also feel like I may need to go to the restroom, but when I do I can't."
50,MISERABLE!!.
51,I have no side effects that I am aware of.
52,I have tried various pain meds for the shoulder and nothing worked.
53,I was skeptical when my doctor asked me to try Arthrotec but my pain is totally under control without any apparent side effects.
54,I had diarrhea for a whole week;bad uterine cramps followed by heavy menstrual bleeding two weeks after my period.
55,Alot of gas and nausea.
56,"This pill stopped my pain, but cause me more pain."
57,The side effects are much worst than the pain itself.
58,This greatly improved the swelling when I had a surgery on both legs.
59,There weren't any side effects.
60,maybe a little gas but may not be related to the drug.
61,I would recommend this to anyone that has swelling of any sort to help heal an injury.
62,The doctor did say to only take it 5 days though because it reduces mucus in the stomach and it can cause extreme stomach pain if taken too long.
63,"I can't describe the horrible stomach pain, constipation, uterine, cramps and pain in the ovaries (menopausal for 20 years) pressure in the stomach, couldn't urinate for a whole day, severe stomach pain, constant burping."
64,The experience was a certain kind of hell!.
65,This drug is a bad trip!.
66,"Within 15 minutes started to have stomach cramping, almost like period cramps."
67,I was on the toilet for a good 30 minutes in extreme pain.
68,"My uterus starting to have spasms which was the worst pain I have ever experienced, I got some nausea from the pain, I had to go to bed in a ball and just lie there until the pain subsided which felt like an eternity."
69,Then when the pain subsided I begin to have some bleeding and I was on day 12 of my cycle.
70,I would rather die than take this drug again.
71,"Although It works wonders for my back pain, it is not worth it to go through the uterus pain and cramping."
72,I am going to try and find a sister drug to arthrotec.
73,"Its weird because I have been taking this drug off and on for about 4 months and this only has happened to me 3 times, but I have no way of knowing when it will randomly happen and it is not worth it to take that risk."
74,I have began to think it has something to do with the day of my cycle affecting how bad the pains will be.
75,"15 minutes after taking , i experienced severe stomach cramping."
76,but after trying celebrex (without any relief).
77,i decided i could tolerate stomach pain since i go relief.
78,"BUT now after having been off of meds for 3 weeks, I am experiencing high blood pressure and ankle swelling like crazy!!!!!"
79,HAS ANYONE EXPERIENCED THIS AFTER BEING OFF OF THE DRUG FOR 3 WEEKS OR SO???????.
80,never take again!!!!.
81,"Stomach cramps, gassy most of the day."
82,Cannot take it on an empty stomach!.
83,I can finally clean my house without pain.
84,"I am feeling so much better, I can sleep all night and rise in the morning without pain."
85,Swelling & weight increase.
86,No relief in pain.
87,My doctor advise that I stop using.
88,"uncontrollable Diarrhea,kidney function."
89,"This product is the best medicine for arthritis pain I have ever taken, however after taking it for approx. 10 years it started affecting my kidneys, my stomach(acid reflux) and the diarrhea got worse, short term, I had no problems,this would be a great product if the manufacturer could get rid of the side effects."
90,"appetite increase, stomach feels empty all the time."
91,"pain feels better, but the appetite increase worries me."
92,"Headache, dizziness."
93,"I took 1 tablet today, and won't take another one."
94,I looked up the side-effects because of a headache and am scared to death by what I read.
95,Some stomach sensitivity.
96,I am taking it only 1 time per day because of the possible side effects.
97,Without this drug I was severly restricted and could only walk less than 100 meters.
98,With the drug I can walk 1/2 km and function.
99,I am thinking of increasing it to twice per day and/or getting surgery and/or epidural steroid injection.
100,"After taking my first pill, I quickly experienced extreme uterine cramping."
101,"It felt like I was having a baby and broke out in a cold sweat, shaking uncontrollably, nauseated, several bowel movements."
102,"I felt like I was going to pass out, which would have been welcommed after feeling what I felt."
103,"The pain subsided fortunately within 15 minutes, but now this morning I have vaginal bleeding and I am only 11 days into my cycle."
104,Do not recommend unless you are prepared to deal with gut wrenching pain and going into shock.
105,"Not worth it, I will continue to take Ibuprofen instead."
106,dizzines dioreah stomach cramps disorientation.
107,"followed by ulceration of the osophragus,and stomach, and possibly the gut."
108,Prone to infections especially of the blader.
109,"have been taken off the drug, stayed on it too long because it allowed me to work."
110,"Talked myself out of the side effects, until they frightened me."
111,"Now I dont know how I am going to get back to work, it has left me feeling exausted, and depressed."
112,i was prescribed arthrotec 75 to take twice a day with or before food.
113,"i took the very first tablet as directed,two hours later i was doubled up in pain with stomach cramps, i had very bad diarrhoa,and heavy menstral bleeding with clots even though i had just finished my cycle a week before."
114,"to add to this i couldnt pass urine,when i eventualy did it was full of blood."
115,i also felt very weak and could not stop shaking.
116,"I spoke with my doctor just hours after taking this medication,i described all my symptoms,the bleeding was dismissed as being a coincedence and nothing to do with the medication!!"
117,I can say that is total rubbish.
118,I would avoid this medication at all costs.
119,I had extreme abdominal pain that came on almost instantly and lasted hours from taking the arthrotec for the first time.
120,I also experienced some bleeding and threw up a number of times.
121,I urge people to think twice about taking this drug.
122,I will not be taking it again.
123,took 4 out of 5 days.
124,"Stomach cramps, gas, constipation, headaches, and, maybe a coincidence, the muscles in my left leg locked up."
125,"Also, up 5-6 times at night to pee; normally 1 or 2."
126,Stopped taking this drug.
127,The side effects more than cancel out the possible benefits.
128,Not fun.
129,"stomack pains, vomited all night about 6 times, abdominal pain, then i got severe vaginal bleeding , horrible."
130,do not take it.
131,"Lower dose for first month produced sporadic intense stomach cramps, diarrhea and nausea."
132,Always prided myself on having a cast iron stomach until this script came along.
133,I have to rate it a 5 for knee pain so I lived with it.
134,Then my doctor increased the dose after one month and I have never had anything work so well on reducing osteoarthritis pain.
135,"Unfortunately, I have also never been so sick from a prescription."
136,"Increased dosage produced constant, unyielding stomach gas and intense pain, gastrointestinal cramping, diarrhea and pain pain pain."
137,"If your gastrointestinal system can handle it, its an amazingly effective arthritis drug."
138,however I welcomed the knee pain back after suffering the side effects and booked an appointment with a knee surgeon!.
139,"Was so sick after 2 days at the increased dose, I decided it just was not worth it."
140,"Feels like menstrual cramps, back ache, sick to stomach for 24 hours +."
141,Was unhappy about being prescribed this but gave it a try since the pharmacy couldn't take it back (mistake -- didn't read about it until after I'd picked up the prescription).
142,"After taking pill with food, feels like menstrual cramps, lower back pain & nausea within 45 minutes."
143,"After the last pill, have been sick to my stomach for over 24 hours."
144,Discontinuing use immediately.
145,Have heard great things about Celebrex.
146,Maybe will ask for that.
147,I experienced mild cramps and bloating.
148,It helped to relieve the pain.
149,Nothing that over the counter Tums or Gas-X couldn't control.
150,I'm avoiding (or delaying) Total Ankle + both knees replacement for post traumaic osteoarthritis due to injuries 30 years.
151,"After starting on Arthrotec, I am able walk with almost no pain and somethimes, no limp."
152,"It has been great, I can walk my dog, go up & down stairs, walk on the beach, go hiking & kayaking."
153,I will take it as long as I can to delay surgery.
154,"I will eventually have the ankle surgery, fighting insurance companies now."
155,It has truly been amazing how this drug has helped me.
156,"NSAID gastritis, severe stomach upset after prolonged use."
157,"false full feeling, very poor appetite."
158,"increased menstruation, 2-3 periods a month instead of once a month, menstrual cramps present with or without vaginal bleeding."
159,i would not recommend this medication for any female who has not already completed their menopausal phase.
160,Some swelling of the legs.
161,I had been unable to get relief from my pain for 2 months following a bone marrow biopsy.
162,I was up to 30 arthritis strength tylenol and numerous Tylenol 3 daily.
163,Couldn't sleep because of the pain.
164,No concentration.
165,Loosing days of work.
166,"Within 2 days of taking the arthrotec 50 (twice daily), the pain was gone."
167,Even the arthritic pain I had in the knees and an ankle.
168,gone.
169,I can sleep again.
170,It is great to be able to sleep & function again.
171,"From one pill : Heavy menstrual bleeding even though my periods ended a week before, cramps, nausea."
172,"Women, beware: do NOT take this medicine unless you've taken it in the past and it was right for you."
173,"Also, do NOT take this if you might be pregnant!"
174,"I checked the reviews on this website before taking this drug, and I thought ""oh, I'm sure it won't happen to me""."
175,"Sure enough, 2 hours after taking a single pill, the bleeding and cramps started."
176,Never again will I touch this drug.
177,"Ongoing stomach problems, had to have an endoscopy to understand why so much pain."
178,"Stopped the drug, got better, but pain in foot meant I had to try again."
179,"I was advised to take Arthrotec with Zantac when necessary, as it would counter the affect on the stomach."
180,"2 weeks later after very small doses there is blood in my stools, major cramps and I have to have a colonoscopy."
181,awful awful awful.
182,I will to have to live with the foot pain because I simply cannot go through this again.
183,I would strongly recommend never going near this drug.
184,"Stomach queasy, but very mild, and goes away."
185,"Just started taking this med after Celebrex 200mg, and before, Meloxicam, other NSAIDs,and natural supplements."
186,Putting off hip & back surgery for life long OA.
187,"Seems to be working fine, pain is limited, though I still limp with damage in hip."
188,Spine & hip pain is greatly reduced!
189,"Menopausal, so waiting to see if minor period bleeding starts like it did with Celebrex."
190,"I'm on no dairy, non-gluten, natural anti-inflammatory diet, no refined sugar."
191,"RA runs in my family, so this is lifelong commitment & it works."
192,Limited caffeine.
193,"This drug works so far, and is giving me back my life."
194,"No irregular bowel or issues so far, and I'm low risk factor for liver, B/P, & cardiac issue."
195,"I take with a meal, use Tums if necessary."
196,Good so far.
197,"Fatigue, Constipation followed by diahorea."
198,Eventually started passing blood and clots with stoals.
199,Painful stomach cramps.
200,"I would not take this drug again, side affects caused me anxiety until I read reviews here of people with similar side affects."
201,"severe headaches, stomach pain, loose stool, all of which spontaneously ended, followed soon after by agonizing muscle spasms in leg with bad knee."
202,Now beginning to experience spasms in left arm.
203,"immediate relief from full body athritic pain, great relief from knee pain--relief from knee pain gradually diminished, probably because I became more active."
204,took celebrex 8-1/2 years.
205,when it stopped working my primary physician put me on arthrotec 75 twice a day.
206,less convenient than the celebrex as twice per day instead of once per day.
207,otherwise as reported by other comments there is occassional joint pain from increased physical activity.
208,"Ate a decent meal and took one pill at 4:30 pm, the 75 size, on 9/10."
209,Within 15-20 minutes my stomach felt empty and hollow.
210,Within 1 hour I had stomach pain that felt like deep pain- like gas pains.
211,I kept eating a small amount of food to make the stomach emptiness and pain ease up.
212,"Went to bed and felt hot flashes and sweated (I don't sweat, am cold natured) and had pain in the pit of my stomach all night."
213,"I felt a deep ache from my waist down to the heels of my feet (Like ""back labor"" pains during childbirth, for those of you who have experienced such a thing, or a prolonged miscarriage.)"
214,My stomach stayed upset and painful through 9/14.
215,"On 9/15 my stomach quit hurting, but the deep pain in my pelvis and down my legs (it felt like my leg bones were filled with cold metal and ached deeply and hurt!)continued through 9/16."
216,"I was just tapering off of my menstrual period when I took the one pill, but noticed an increase in cramping and breasts getting more and more (and more!."
217,The side effects were harder to deal with than the condition I was taking it for- and it made me feel 200% worse!
218,Not worth it!
219,I will carefully take ibuprofen or Aleve (naproxen sodium)- limit using it as much as I am able- and deal with ulcers if I ever end up with one!
220,Taking this horrid stuff to prevent one just is not worth it!
221,"Pharmacist finds it hard to believe one pill did all this- but looked at other meds, and no other explaination."
222,"I took last Lyrica, after a two week trial, on 9/15."
223,"FYI:(I reacted about the same way (excessive mestrual bleeding) to oral, low-dose Prednisone, as well.)"
224,I seem to be more hormonally/chemically sensitive than a lot of people.
225,"It may not be important, but it MAY be> I cannot take, whether because of over-reaction, adverse reaction, allergy: Birth control pills or shots, Codeine, any opiate-based, hydrocodone, prednisone, corti-cortisones, pseudoephedrine, morphine, demerol, percocette, darvon, cyclobenzoprene, (sulfur drugs listed as possibly lethal due to parent's reaction.)"
226,"Allergic to citrus fruits & bioflavenoids, lanolin/wool, and topical Benedryl."
227,"The only side effect that I experienced was the hungry feeling in my stomach ;however I have no complaints, just praise !"
228,Deborah McCready.
229,Lower Back Pain.
230,"Love it so far, finally slept last night."
231,After to Lower back surgeries and intense daily pain I am so relieved to get so rest.
232,"Initially, I experienced a slight, but noticeable difference in pain level: the pain was less severe."
233,"Within a few days, I noticed acid reflux shortly after taking, and it got progressively worse."
234,"It got to the point that I was apprehensive about going to bed; I consistently found myself waking up with acidic bile in my mouth, tasting like I had thrown up."
235,None that I noticed.
236,"I did take my blood pressure today though, and it was slightly elevated from the norm."
237,"I suspect the drug is responsible, but as I am only taking it short-term, I am not overly concerned."
238,I had acute shoulder tendonitis and was in absolute agony.
239,"Within 24 hours of taking this medicine, the inflammation was reduced dramatically and I have continued to improve, gaining back more of my range of motion with each day."
240,"I took the drug only once, at about 9:00 p.m."
241,"15 minutes later I experienced dizziness, nausea, and stomach pain, followed about 10 minutes later by level 6 pain in major joints (knees, hips, shoulders, elbows, hands)."
242,Elevated blood pressure and heart palpitations.
243,Still felt somewhat dizzy and sick the next day.
244,Extreme gas in stomach and intestines for several days afterward.
245,"Had acid reflux-type symptoms for a few days, though I have never had reflux."
246,Evil drug!!.
247,"Some stomach irritation, feels a bit like my pressure is up (in my head mostly)."
248,I pulled my lower back at the gym 2 times.
249,last time was about 1 1/2 years ago and it was pretty bad.
250,Since then my back has really gotten worse.
251,"I still exercise everyday and stretch, but it really is not helping."
252,I final went to the doctor and i am getting x-rays on my spine tomorrow.
253,He gave me about 25 samples of Arthrotec 75.
254,3 days later I cannot believe how good my back feels.
255,"It has to be this drub, because this is the first day i can comfortably bend down with no pain and even touch my toes without bending my knees."
256,"It seems that this drug, like many drugs, works for some and not for all."
257,as for me seems to be really good.
258,Took 50 mg arthrotec with one tylenol #3 and within 30 minutes I had the most severe abdominal pain I've ever experienced.
259,It was more like bowel/uterine cramping.
260,It was so severe I had to go to the emergency room.
261,"I had spent the day there already for my shoulder pain, was given a prescription and never told of these side effects."
262,I then spent the night back in the ER for the severe pain.
263,"The doctor thought it was likely the codeine in the tylenol #3 but after reading all these comments, I doubt it very much."
264,Will never take this medication again.
265,"Severe abdominal pain,bloating,gas,nauseous,constant hunger."
266,These symptoms persisted three days after I stopped taking the drug.
267,My stomach is still sore when palpitated after 5 days.
268,Please think twice before taking this drug.
269,"I had been taking two tablets per day (one @ breakfast time ,the other @ dinner time) for a couple of years when I was alerted to possible long term side effects & then consulted my GP who advised because of the time I had been taking them to only take them on a ""need to basis""."
270,"I immediately stopped completely but found that I had muscular pains all over my body,I have now reduced my intake to one per day @ breakfast time & find that this has proved a moderately succesful outcome."
271,Particularly diahrea!
272,Many unscheduled washroom stops over the time I've taken this medication.
273,Lately ankle swelling and lower tendon pain that was not experienced previously.
274,Males tend to tolerate this medication better than women from my observation.
275,This medication helped get me back to work and achieve tolerable pain levels and mobility.
276,I stopped taking it for 4 days and the pain returned.
277,Currently take one 75mg dose 2 hours before work and seems to be enough to ease my particular condition.
278,Probably alright for otherwise healthy individuals but those with other medical problems should probably avoid it.
279,It will most likely exacerbate there ill health with unwelcome side effects.
280,"I was prescribed this drug because I had spent a whole night in complete agony; abdominal pain, lower back pain, all that I imagine labor pain to be, except I was not in labor."
281,"Though the cause of my pain remains undetermined, the Arthrotec combined with Paracetamol pretty much eliminated the pain."
282,"This was a big relief, as the 1200 MG of Ibuprofen I had taken throughout the night had done nothing."
283,I only took 1 Arthrotec and 1 Paracetamol and that did the trick.
284,HOWEVER: I had a very bad headache yesterday and Ibuprofen again didn't work.
285,"I still had the other Arthrotec pills left, so I took one."
286,"Although it alleviated the pain, I got up this morning with heavy vaginal bleeding even though my period ended last week."
287,"I was relieved to read that this could be a side effect, as it means I probably don't have something serious, but I will have to be in some serious pain to risk bleeding from the vagina again."
288,Next time I'll try my luck with Paracetamol.
289,The pill I took consisted of 50 MG Diclofenac and 200 MG Misoprostol.
290,"just took the drug about 30 minutes ago and am now experiencing the worst abdominal pain ever, like mentstrual cramps/diarreah cramping combined."
291,i had to keep dropping into a crouched position due to the severity of the lower abdominal pain.
292,i was put on this medication because i was taking such high doses of Advil to quell the inflammation in my neck and back muscles that it caused me to have a GI bleed.
293,"but after this little episode, and after reading that it can cause heavy menstrual bleeding, i highly doubt this drug is the best fit for my problem!!"
294,i already have anemia due to the gastric bleed.
295,how could my doctor not think of this?
296,"i'm also starting to feel dizzy and light headed, and can feel acidic bile at the back of my throat."
297,great!!
298,:|.
299,slightly heavier menstrual cycle.
300,An absolute miracle drug for me.
301,None of the stomach issues others seem to have.
302,I was at the point where I was becoming highly immobile and in constant pain.
303,Started taking arthrotec and had IMMEDIATE relief.
304,honestly never thought I would feel that way again.
305,"recently pain has started to increase though, and not sure if I've overworked my back."
306,or if I'm becoming intolerant.
307,Have recommended to two others who have had similar exceptional results for chronic arthritic type issues.
308,1 month PRN.
309,Horrible lower pelvic pain.
310,Uterus contractions.
311,Bloody vagina the next day.
312,Horrible gastric pain.
313,I am looking for another drug to replace this one.
314,I went to the OB GYN thinking there was something wrong with my uterus but I am completely ok.
315,I am not taking it again.
316,"heartburn, nausea, frequent feelings of voracious hunger & sharp unbearable cramping pains in lower gut."
